{
	"$schema": "./$schema/assets/SC_Unit_Article.json",
	"title": "An Article Title",
	"picture": "rel:placeholder.png",
	"introduction": "Sed ut perspiciatis unde omnis iste natus error sit voluptatem accusantium doloremque laudantium, totam rem aperiam, eaque ipsa quae ab illo inventore veritatis et quasi architecto beatae vitae dicta sunt explicabo.",
	"sections": [
		{
			"title": "A Section Title",
			"paragraphs": [
				"Lorem ipsum dolor sit amet, consectetur adipiscing elit, sed do eiusmod tempor incididunt ut labore et dolore magna aliqua.",
				"Ut enim ad minim veniam, quis nostrud exercitation ullamco laboris nisi ut aliquip ex ea commodo consequat."
			]
		}
	]
}